{"source_tif":"/home/lachlan/ProjectsLFS/Zhengyu/DEO/App80 DEO/10uM/05-十二月-2025/10x00.tif","source_png":"/home/lachlan/ProjectsLFS/Zhengyu/api-tests/organoid_codex_polygon_segmentation_test/output/05-十二月-2025_10x00_20260311_232401/10x00.png","image_width_px":2880,"image_height_px":2048,"magnification_token":"unknown","segmentation_note":"Conservative manual segmentation from the source image, prioritizing clear large/fused masses and distinct medium round organoids; halo/ring boundary and tiny debris were excluded.","organoids":[{"organoid_id":"organoid_01","morphology":"fused_mass","confidence_0_to_1":0.92,"polygon_xy":[[1010,620],[1100,560],[1240,520],[1380,510],[1540,530],[1670,590],[1760,700],[1820,820],[1810,920],[1700,980],[1570,1000],[1430,980],[1300,950],[1180,900],[1080,820],[1010,730]],"note":"Dominant central dark fused mass."},{"organoid_id":"organoid_02","morphology":"irregular_organoid","confidence_0_to_1":0.8,"polygon_xy":[[1260,320],[1320,250],[1420,220],[1530,230],[1650,250],[1740,310],[1790,390],[1760,470],[1670,510],[1560,500],[1470,470],[1380,450],[1300,400]],"note":"Lobulated cluster above the central mass."},{"organoid_id":"organoid_03","morphology":"irregular_organoid","confidence_0_to_1":0.83,"polygon_xy":[[1860,560],[1940,510],[2050,500],[2150,550],[2210,640],[2200,720],[2120,780],[2010,790],[1920,750],[1860,670]],"note":"Distinct upper-right lobulated organoid cluster."},{"organoid_id":"organoid_04","morphology":"fused_mass","confidence_0_to_1":0.86,"polygon_xy":[[1810,930],[1900,890],[2010,900],[2110,960],[2160,1060],[2140,1160],[2060,1220],[1940,1230],[1840,1180],[1790,1080]],"note":"Large textured mid-right mass."},{"organoid_id":"organoid_05","morphology":"fused_mass","confidence_0_to_1":0.9,"polygon_xy":[[1210,1320],[1320,1220],[1470,1210],[1610,1260],[1720,1360],[1780,1490],[1750,1630],[1650,1750],[1510,1820],[1370,1800],[1260,1710],[1180,1570],[1160,1430]],"note":"Elongated dense lower fused mass."},{"organoid_id":"organoid_06","morphology":"round_organoid","confidence_0_to_1":0.82,"polygon_xy":[[770,900],[810,860],[880,850],[940,880],[960,940],[930,990],[860,1000],[790,970]],"note":"Distinct medium round/oval organoid left of center."},{"organoid_id":"organoid_07","morphology":"round_organoid","confidence_0_to_1":0.78,"polygon_xy":[[1060,1080],[1100,1040],[1160,1040],[1210,1080],[1220,1140],[1180,1190],[1110,1200],[1060,1160]],"note":"Central medium round organoid."},{"organoid_id":"organoid_08","morphology":"round_organoid","confidence_0_to_1":0.8,"polygon_xy":[[1810,1460],[1860,1410],[1940,1400],[2010,1450],[2020,1520],[1980,1580],[1900,1600],[1830,1560]],"note":"Distinct lower-right round organoid."},{"organoid_id":"organoid_09","morphology":"round_organoid","confidence_0_to_1":0.72,"polygon_xy":[[1820,1240],[1880,1210],[1950,1220],[1990,1270],[1980,1340],[1930,1390],[1860,1390],[1810,1340]],"note":"Mid-lower right round organoid between larger right-side masses."}]}