{"source_tif":"/home/lachlan/ProjectsLFS/Zhengyu/DEO/App80 DEO/10uM/05-十二月-2025/10x00.tif","source_png":"/home/lachlan/ProjectsLFS/Zhengyu/api-tests/organoid_codex_polygon_segmentation_test/output/05-十二月-2025_10x00_20260312_002437/10x00.png","image_width_px":2880,"image_height_px":2048,"magnification_token":"10x","segmentation_note":"Conservative coarse pass: included clearly visible dense organoid masses/clusters only; excluded dish boundary ring, faint halos, and scattered debris.","organoids":[{"organoid_id":"organoid_01","morphology":"fused_mass","confidence_0_to_1":0.93,"polygon_xy":[[1210,680],[1290,560],[1430,520],[1570,540],[1720,620],[1810,760],[1790,900],[1670,980],[1510,1000],[1370,960],[1250,860]],"note":"Large upper central fused dark mass with lobulated top edge."},{"organoid_id":"organoid_02","morphology":"fused_mass","confidence_0_to_1":0.91,"polygon_xy":[[1220,1210],[1360,1120],[1510,1130],[1650,1220],[1720,1360],[1710,1530],[1610,1690],[1450,1770],[1320,1730],[1210,1600],[1140,1430]],"note":"Large lower central elongated fused mass."},{"organoid_id":"organoid_03","morphology":"irregular_organoid","confidence_0_to_1":0.86,"polygon_xy":[[1850,760],[1990,700],[2140,740],[2250,860],[2260,1020],[2200,1170],[2070,1240],[1930,1200],[1820,1080],[1790,920]],"note":"Right-side compact irregular organoid cluster contiguous in source image."},{"organoid_id":"organoid_04","morphology":"irregular_organoid","confidence_0_to_1":0.68,"polygon_xy":[[823,869],[900,829],[982,850],[1028,922],[1008,997],[929,1034],[855,1008],[804,949]],"note":"Small left-mid dark organoid-like clump; weaker contrast than main masses."}]}