{"source_tif":"/home/lachlan/ProjectsLFS/Zhengyu/DEO/App80 DEO/10uM/05-十二月-2025/10x00.tif","source_png":"/home/lachlan/ProjectsLFS/Zhengyu/api-tests/organoid_codex_polygon_segmentation_test/output/05-十二月-2025_10x00_20260312_002437/10x00.png","image_width_px":2880,"image_height_px":2048,"magnification_token":"10x","segmentation_note":"Refined from coarse pass by tightening to dense visible boundaries, recovering obvious clipped lobes on major masses, and keeping conservative exclusion of dish rim/halos/debris.","organoids":[{"organoid_id":"organoid_01","morphology":"fused_mass","confidence_0_to_1":0.94,"polygon_xy":[[1170,700],[1220,560],[1300,450],[1450,400],[1610,430],[1740,520],[1830,670],[1860,810],[1810,930],[1690,1000],[1530,1020],[1380,980],[1260,900]],"note":"Upper central fused dark mass; polygon tightened and expanded to include superior lobulated cap."},{"organoid_id":"organoid_02","morphology":"fused_mass","confidence_0_to_1":0.92,"polygon_xy":[[1180,1220],[1310,1130],[1470,1110],[1610,1160],[1710,1260],[1760,1410],[1740,1570],[1650,1710],[1490,1810],[1340,1770],[1220,1650],[1140,1490],[1120,1350]],"note":"Lower central elongated fused mass; boundary tightened and inferior extent preserved."},{"organoid_id":"organoid_03","morphology":"irregular_organoid","confidence_0_to_1":0.88,"polygon_xy":[[1820,760],[1950,690],[2100,710],[2220,800],[2290,930],[2270,1080],[2180,1210],[2050,1260],[1910,1220],[1810,1110],[1770,940]],"note":"Right-side irregular compact cluster; refined to visible outer edge including upper-right lobe."},{"organoid_id":"organoid_04","morphology":"irregular_organoid","confidence_0_to_1":0.71,"polygon_xy":[[810,875],[890,830],[975,845],[1030,910],[1020,995],[945,1040],[860,1020],[805,950]],"note":"Small left-mid organoid-like dark clump retained; minor boundary tightening."}]}